{
  "format_version": 1,
  "plan_id": "plan-2026-10-25-001",
  "created_at": "2026-10-25T09:00:00Z",
  "lead": {
    "provider": "claude",
    "auth_mode": "subscription"
  },
  "request_summary": "Add a settings screen with a usage panel and tests.",
  "summary_budget_tokens": 200,
  "tasks": [
    {
      "id": "t1",
      "title": "Build the settings screen",
      "role": "frontend",
      "provider": "claude",
      "auth_mode": "subscription",
      "owned_files": ["src/features/settings/index.tsx", "src/features/settings/form.tsx"],
      "acceptance": ["Settings screen renders every limit", "make check-fast passes"],
      "depends_on": [],
      "estimated_usage": {
        "prompts": 10,
        "turns": 20
      },
      "fallback_providers": [
        {
          "provider": "codex",
          "auth_mode": "subscription"
        }
      ]
    },
    {
      "id": "t2",
      "title": "Build the usage panel",
      "role": "frontend",
      "provider": "codex",
      "auth_mode": "subscription",
      "owned_files": ["src/features/usage/index.tsx"],
      "acceptance": ["Panel shows per-provider usage against the ceilings"],
      "depends_on": [],
      "estimated_usage": {
        "prompts": 12,
        "turns": 25
      },
      "fallback_providers": [
        {
          "provider": "claude",
          "auth_mode": "subscription"
        }
      ]
    },
    {
      "id": "t3",
      "title": "Review the settings and usage diffs",
      "role": "reviewer",
      "provider": "codex",
      "auth_mode": "subscription",
      "owned_files": [],
      "acceptance": ["Review notes cover every acceptance item of t1 and t2"],
      "depends_on": ["t1", "t2"],
      "estimated_usage": {
        "prompts": 6,
        "turns": 10
      },
      "fallback_providers": [
        {
          "provider": "claude",
          "auth_mode": "subscription"
        }
      ]
    }
  ]
}
